{
    "schema_version":  "1",
    "execution_id":  "v5-serious-live-pilot-no-coordinator-remediation-status-runtime-launch-runtime-execution",
    "generated_by":  "specbridge-cli",
    "runtime_launch_path":  ".specbridge/runtime-launches/v5-serious-live-pilot-no-coordinator-remediation-status.runtime-launch.json",
    "launch_id":  "v5-serious-live-pilot-no-coordinator-remediation-status-runtime-launch",
    "task_id":  "v5-serious-live-pilot-no-coordinator-remediation",
    "packet_id":  "v5-serious-live-pilot-no-coordinator-remediation-status",
    "slice_id":  "status",
    "branch_name":  "codex/v5-serious-live-pilot-no-coordinator-remediation",
    "dry_run":  false,
    "timeout_seconds":  600,
    "allowed_tools":  [
                          "Read",
                          "Write"
                      ],
    "permission_mode":  "acceptEdits",
    "max_budget_usd":  "2.00",
    "command_summary":  "claude -p --no-session-persistence --max-budget-usd 2.00 --permission-mode acceptEdits --tools Read,Write --allowedTools Read,Write --input-format text",
    "prompt_sections":  [
                            "Read README.md, SPECBRIDGE.md, AGENTS.md, CLAUDE.md, .specbridge/policy.yaml, the execution contract, and the executor packet before writing.",
                            "Modify only paths declared in exclusive_write.",
                            "Treat read_only paths as context only.",
                            "Run only required validations that are explicitly allowed by the runtime operator.",
                            "Stop on policy conflict, scope conflict, missing required context, impossible acceptance criteria, protected resource requirement, secrets, production configuration, billing, authentication security, authorization security, dependency installation, database change, CI/CD security change, or deployment automation.",
                            "Report changed files, validation evidence, policy result, unresolved risks, and completion status."
                        ],
    "execution_status":  "succeeded",
    "exit_code":  0,
    "timed_out":  false,
    "stdout":  {
                   "captured":  true,
                   "length":  2168,
                   "line_count":  21,
                   "sha256":  "4e72ea42f69467cf83923350f62acd5d67e2a253154d7832789fadd617ff797a"
               },
    "stderr":  {
                   "captured":  true,
                   "length":  0,
                   "line_count":  0,
                   "sha256":  "e3b0c44298fc1c149afbf4c8996fb92427ae41e4649b934ca495991b7852b855"
               },
    "failure_diagnostics":  {
                                "status":  "not_applicable",
                                "reason":  "execution_succeeded",
                                "exit_code":  0,
                                "timed_out":  false,
                                "redaction_policy":  "bounded_preview_240_chars_with_secret_token_patterns_redacted",
                                "stdout_preview":  {
                                                       "text":  "Summary:\n- The status slice goal was already satisfied in the working tree from a prior launch of this same slice; this run verified it rather than re-applying it.\n- `scripts/lib/status.ps1`, function `Invoke-V5SeriousPilotStatusCommand`, e",
                                                       "original_length":  2168,
                                                       "preview_length":  240,
                                                       "max_length":  240,
                                                       "truncated":  true
                                                   },
                                "stderr_preview":  {
                                                       "text":  "",
                                                       "original_length":  0,
                                                       "preview_length":  0,
                                                       "max_length":  240,
                                                       "truncated":  false
                                                   }
                            },
    "policy_result":  "Controlled Claude Code launch executed with bounded tools, budget, timeout, and repository-scoped launch plan.",
    "execution_policy":  {
                             "launches_claude":  true,
                             "launches_antigravity":  false,
                             "executes_shell":  false,
                             "requires_network":  true,
                             "touches_secrets":  false,
                             "touches_production":  false,
                             "installs_dependencies":  false,
                             "deploys":  false
                         },
    "source_files":  [
                         ".specbridge/runtime-launches/v5-serious-live-pilot-no-coordinator-remediation-status.runtime-launch.json"
                     ]
}