{
    "schema_version":  "1",
    "execution_id":  "issue-087-budget-aware-v5-status-status-runtime-launch-runtime-execution",
    "generated_by":  "specbridge-cli",
    "runtime_launch_path":  ".specbridge/runtime-launches/issue-087-status.runtime-launch.json",
    "launch_id":  "issue-087-budget-aware-v5-status-status-runtime-launch",
    "task_id":  "issue-087-budget-aware-v5-status",
    "packet_id":  "issue-087-budget-aware-v5-status-status",
    "slice_id":  "status",
    "branch_name":  "claude/issue-087-budget-aware-v5-status-status",
    "dry_run":  false,
    "timeout_seconds":  900,
    "allowed_tools":  [
                          "Edit",
                          "Read",
                          "Write"
                      ],
    "permission_mode":  "acceptEdits",
    "max_budget_usd":  "2.00",
    "command_summary":  "claude -p --no-session-persistence --max-budget-usd 2.00 --permission-mode acceptEdits --tools Edit,Read,Write --allowedTools Edit,Read,Write --input-format text",
    "prompt_sections":  [
                            "Read README.md, SPECBRIDGE.md, AGENTS.md, CLAUDE.md, .specbridge/policy.yaml, the execution contract, and the executor packet before writing.",
                            "Modify only paths declared in exclusive_write.",
                            "Treat read_only paths as context only.",
                            "Run only required validations that are explicitly allowed by the runtime operator.",
                            "Stop on policy conflict, scope conflict, missing required context, impossible acceptance criteria, protected resource requirement, secrets, production configuration, billing, authentication security, authorization security, dependency installation, database change, CI/CD security change, or deployment automation.",
                            "Report changed files, validation evidence, policy result, unresolved risks, and completion status."
                        ],
    "execution_status":  "failed",
    "exit_code":  1,
    "timed_out":  false,
    "stdout":  {
                   "captured":  true,
                   "length":  61,
                   "line_count":  2,
                   "sha256":  "c3a5a3fc1de76258ece8d0dad46c4c8ca152416f8228fb077c0b172fea43cf63"
               },
    "stderr":  {
                   "captured":  true,
                   "length":  0,
                   "line_count":  0,
                   "sha256":  "e3b0c44298fc1c149afbf4c8996fb92427ae41e4649b934ca495991b7852b855"
               },
    "failure_diagnostics":  {
                                "status":  "recorded",
                                "reason":  "stdout_only_failure",
                                "exit_code":  1,
                                "timed_out":  false,
                                "redaction_policy":  "bounded_preview_240_chars_with_secret_token_patterns_redacted",
                                "stdout_preview":  {
                                                       "text":  "You\u0027ve hit your limit ? resets 4:10pm (America/Buenos_Aires)\n",
                                                       "original_length":  61,
                                                       "preview_length":  61,
                                                       "max_length":  240,
                                                       "truncated":  false
                                                   },
                                "stderr_preview":  {
                                                       "text":  "",
                                                       "original_length":  0,
                                                       "preview_length":  0,
                                                       "max_length":  240,
                                                       "truncated":  false
                                                   }
                            },
    "policy_result":  "Controlled Claude Code launch executed with bounded tools, budget, timeout, and repository-scoped launch plan.",
    "execution_policy":  {
                             "launches_claude":  true,
                             "launches_antigravity":  false,
                             "executes_shell":  false,
                             "requires_network":  true,
                             "touches_secrets":  false,
                             "touches_production":  false,
                             "installs_dependencies":  false,
                             "deploys":  false
                         },
    "source_files":  [
                         ".specbridge/runtime-launches/issue-087-status.runtime-launch.json"
                     ]
}